{
  "mission": {
    "ask": "Add a CSV export button",
    "done_state": "pr-ready",
    "done_when": ["The change is implemented and one pull request is open"],
    "halts": []
  },
  "outcome": "stuck",
  "note": "The target repository cannot be read.",
  "blockers": ["Restore read access to the target repository"]
}
